person,year_raw,event,type,subtype,phase
fong,초·중·고,시카고 외곽에서 성장,개인사,relocation,k12
fong,학부,"MIT 항공우주공학 입학, 비행기 설계가 꿈이었다가 로봇으로 관심 전환",교육,bs_enroll,undergrad
fong,학부 2학년,"MIT Space Systems Lab(Dave Akin) 시간제 일자리, neutral buoyancy 로보틱스 시작",네트워크,mentor_meet,undergrad
fong,1988,MIT 학사 학위 취득,교육,bs_graduate,undergrad
fong,석사,MIT Space Systems Lab에서 SPAM(Stewart Platform Augmented Manipulator) 수중 로봇 팔 개발,연구·프로젝트,proj_start,grad
fong,1990,MIT 항공우주 석사 학위 취득,교육,ms_graduate,grad
fong,1990,NASA Ames 첫 입사 (박사 진학 전 break),직업 이력,hire,early_career
fong,1990~1991,"Mike Sims 그룹장 시기, iWARP/parallel computing, VR 인터페이스 연구",연구·프로젝트,proj_start,early_career
fong,1991 무렵,"Butler Hine로 그룹장 교체, VR 사용자 인터페이스 본격화 (Polhemus/Ascension 트래킹)",연구·프로젝트,proj_start,early_career
fong,1990년대 초,"Carol Stoker 등 행성과학자와 협업, McMurdo Sound 남극 ROV 원격조작",연구·프로젝트,demo,early_career
fong,1994,CMU와 Dante II 화산(Mount Spurr) 탐사 로봇 협업,연구·프로젝트,demo,early_career
fong,1994,"NASA Ames 1차 근무 종료, CMU 로보틱스 박사과정 입학",교육,phd_enroll,grad
fong,CMU 초기,Chuck Thorpe·Red Whittaker 지도하 Navlab에 proprioception 추가 연구,교육,phd_advisor,grad
fong,박사 1.5년 후,"아내가 스위스 연구그룹 합류로 Pittsburgh 떠나 스위스 이주, EPFL에서 박사 연구 수행",개인사,relocation,grad
fong,1996-03~2000-12,"Fourth Planet, Inc. 공동창업·부사장 (캘리포니아 startup, VR 시각화)",창업·산업,company_found,grad
fong,EPFL 시기,"Charles Baur 공동지도, Virtual Reality and Active Interface 그룹, Pioneer 로봇으로 collaborative control 연구",교육,phd_thesis,grad
fong,2001,Carnegie Mellon 박사 학위 취득 (HRI / collaborative control),교육,phd_graduate,grad
fong,2002~2004,EPFL VR & Active Interfaces 그룹 부리더 / 포닥,교육,postdoc,early_career
fong,2004-06,"NASA Ames 복귀, Illah Nourbakhsh와 협업",직업 이력,hire,early_career
fong,2004 직후,"Peer-to-Peer Human Robot Interaction 프로젝트 출범 (Reid Simmons, Robonaut group, Alan Schultz/NRL과 협업)",연구·프로젝트,proj_start,early_career
fong,2004 후반,"Illah Nourbakhsh의 CMU 복귀로 그룹 디렉터 인계, 약 15명 → 32명으로 성장",직업 이력,admin_role,early_career
fong,2000년대 후반,"Robots for Human Exploration 방향 전환, planetary mapping (HiRISE/MRO, LROC, Apollo Metric Camera) 작업",실패·전환,pivot,mid_career
fong,2000년대 후반,"Google Earth Moon/Mars 협업 (옆 캠퍼스), GigaPan 활용",창업·산업,industry_collab,mid_career
fong,2010 무렵,GigaPan 기반 시뮬레이션 인간 탐사 미션 scouting (대중 크라우드소싱),연구·프로젝트,proj_start,mid_career
fong,2011-06-10,Moffett Field(CA)에서 IEEE 구술 인터뷰,개인사,personal_other,mid_career
fong,2017,NASA Senior Scientist for Autonomous Systems 임명 (Intelligent Robotics Group 디렉터 종료),직업 이력,promotion,senior
forlizzi,출생,"미국 펜실베이니아 Harrisburg 출생, Harrisburg에서 성장",개인사,birth,k12
forlizzi,학부,Philadelphia College of Art (University of the Arts) BFA 일러스트레이션,교육,bs_graduate,undergrad
forlizzi,1985~1995,"UPenn School of Engineering Information Designer 근무 (학부 시기 시작), 이론물리학·재료공학자들과 협업",직업 이력,hire,undergrad
forlizzi,1986~1996,필라델피아에서 Inks Creative Services 창립자,창업·산업,company_found,undergrad
forlizzi,석사 시기,"CMU 인터랙션 디자인 석사, GPS 하이킹 스틱 프로젝트로 Apple 학생 공모전 우승, Interval/Apple 견학",수상·명예,paper_award,grad
forlizzi,1997,CMU Interaction Design 석사 학위 취득,교육,ms_graduate,grad
forlizzi,~1997,CMU Novum Design Center Design Researcher,직업 이력,hire,early_career
forlizzi,1998~1999,시카고 E-Lab LLC Innovator/Project Manager (사용자 리서치 컨설팅),직업 이력,move,early_career
forlizzi,2000 초,CMU HCI Institute / School of Design 조교수 부임 (HCI Institute 첫 디자이너),직업 이력,hire,early_career
forlizzi,2000년대 초,"Nursebot 프로젝트 합류, 노인 사용 연구 4개월 → 머리 디자인 재설계 (Carl DiSalvo, Francine Gemperle 협업)",연구·프로젝트,proj_start,early_career
forlizzi,2000년대 초,"ITR 대형 그랜트 수주, Reid Simmons와 첫 협업",네트워크,collab_start,early_career
forlizzi,이후 연구,"Hug(원격 통신 봉제 인형), SenseChair(앉은 자세 인지 의자), Roomba 가정 연구",연구·프로젝트,proj_start,early_career
forlizzi,중반 협업,Bilge Mutlu와 Aethon TUG 병원 로봇 연구 (암 병동 vs 산후 병동 대조),연구·프로젝트,proj_start,early_career
forlizzi,2007,CMU에서 자가정의(self-defined) Design + HCI 박사 학위 취득,교육,phd_graduate,early_career
forlizzi,2006 무렵,Snackbot 자체 개발 시작 (4년간 디자인 주도 로봇),연구·프로젝트,proj_start,early_career
forlizzi,HRI 형성기,Sara Kiesler·Pam Hinds와 ACM HRI Conference 출범 및 young researchers workshop 공동 운영,학회·커뮤니티,conf_create,early_career
forlizzi,2010 무렵,"HERB 로봇(Sidd Srinivasa)에 디자인 협업, 척수손상 청년 사용자 연구",연구·프로젝트,proj_start,early_career
forlizzi,2011-01,Snackbot 파일럿 시작 예정 (인터뷰 시점),연구·프로젝트,demo,early_career
forlizzi,인터뷰 시점,"QoLT(Quality of Life Technology Center) 6년차, Manuela Veloso/Howie Choset/Reid Simmons 등 다학제 grant 참여",연구·프로젝트,proj_start,early_career
forlizzi,2010-11-23,"Pittsburgh, PA에서 IEEE 구술 인터뷰",개인사,personal_other,early_career
forlizzi,2014,CMU 정교수(Full Professor) 승진,직업 이력,promotion,mid_career
forlizzi,컨설팅,"Willow Garage, Disney Research 등 자문",창업·산업,industry_collab,mid_career
fukuda,1948-12-12,일본 토야마(富山) 출생,개인사,birth,k12
fukuda,초·중·고,일본에서 초등·중등·고등 교육 이수,교육,k12_enroll,k12
fukuda,학부,"Waseda University 기계공학, Tsuchiya·Kato 교수 사사 (생체역학·이족보행 로봇)",교육,bs_enroll,undergrad
fukuda,학부 시기,인체 장기 유지용 순환 시스템 및 fluidic system 연구 1년 수행,연구·프로젝트,proj_start,undergrad
fukuda,1971,Waseda University 학사(B.E.) 학위 취득,교육,bs_graduate,undergrad
fukuda,1973,University of Tokyo 석사(M.S.) 학위 취득,교육,ms_graduate,grad
fukuda,1973~1977,"Yale University(New Haven, CT)에서 advanced adaptive control 등 연구",교육,sabbatical_visit,grad
fukuda,1977,University of Tokyo 박사(D.Sc.) 학위 취득,교육,phd_graduate,grad
fukuda,1977~1979,Tsukuba 일본 정부 National Mechanical Engineering Laboratory(AIST) Research Scientist,직업 이력,hire,early_career
fukuda,1979~1980,University of Stuttgart(서독) Visiting Research Fellow,교육,sabbatical_visit,early_career
fukuda,1981~1989,"Science University of Tokyo 부교수, 본격적인 로봇 연구 시작",직업 이력,hire,early_career
fukuda,1983~1984,첫 inspection & maintenance 로봇 (정유 탱크 등 hostile 환경) 연구 착수,연구·프로젝트,proj_start,early_career
fukuda,1980년대 중반,일본 로봇학회 내 Factory Inspection & Maintenance Robots 기술위원회 조직,학회·커뮤니티,committee,early_career
fukuda,1986~1987,micromanipulator 개발 시작 (연못의 미생물 관찰 계기),연구·프로젝트,proj_start,early_career
fukuda,1980년대,Denso 등 산업체와 모듈러 robotic line 협업,창업·산업,industry_collab,early_career
fukuda,1988,IEEE IROS(International Conference on Intelligent Robots and Systems) 도쿄에서 창립 General Chair,학회·커뮤니티,conf_create,early_career
fukuda,1989~2013,Nagoya University 기계공학과 교수,직업 이력,promotion,mid_career
fukuda,1990~2011,MHS(Int'l Symp. on Micro-Nano Mechatronics and Human Science) 창립 Chair,학회·커뮤니티,conf_create,mid_career
fukuda,1990년대,"Cellular Robotic System 이론화, neural network 결합 연구",연구·프로젝트,breakthrough,mid_career
fukuda,1994,Cellular Robotic System 단행본 출간,연구·프로젝트,paper,mid_career
fukuda,1995,IEEE Fellow 선임,수상·명예,fellow,mid_career
fukuda,1997,IEEE Eugene Mittelmann Achievement Award 수상,수상·명예,lifetime_award,mid_career
fukuda,1998~1999,IEEE Robotics and Automation Society 회장,학회·커뮤니티,editorship,senior
fukuda,2000,IEEE Third Millennium Medal,수상·명예,lifetime_award,senior
fukuda,2001~2002,IEEE Division X Director,학회·커뮤니티,committee,senior
fukuda,2002~2005,IEEE Nanotechnology Council 창립 회장,학회·커뮤니티,editorship,senior
fukuda,2004,IEEE RAS Pioneer Award,수상·명예,lifetime_award,senior
fukuda,2005,IEEE ARSO(Advanced Robotics Technology and Social Impacts) 워크숍 창립 Chair,학회·커뮤니티,conf_create,senior
fukuda,2000년대,"의료 로봇(intravascular surgery) 연구, MRI/CT 기반 인간 혈관 시뮬레이터 개발",연구·프로젝트,proj_start,senior
fukuda,2000년대 후반,인체 시뮬레이터 상용화 위한 venture spin-off 회사 설립 (인터뷰 시점 6~7년 운영),창업·산업,company_found,senior
fukuda,2008,IEEE SII(System Integration International) 워크숍 창립 Chair,학회·커뮤니티,conf_create,senior
fukuda,2009,IEEE RAS George Saridis Leadership Award,수상·명예,lifetime_award,senior
fukuda,2010,IEEE Technical Field Award on Robotics and Automation,수상·명예,lifetime_award,senior
fukuda,2011,IEEE/RSJ IROS Harashima Award,수상·명예,lifetime_award,senior
fukuda,2011-09-25,San Francisco에서 IEEE 구술 인터뷰,개인사,personal_other,senior
fukuda,2013,Nagoya University 정년 퇴임 후 Meijo University 및 Beijing Institute of Technology 교수 부임,직업 이력,retire,senior
fukuda,2013~2014,IEEE Region 10 Director,학회·커뮤니티,committee,senior
fukuda,2015,일본 정부 자수포장(Medal of Honor with Purple Ribbon) 수훈,수상·명예,gov_honor,senior
fukuda,2017,중국과학원 외국인 회원 선출,수상·명예,fellow,senior
fukuda,2017~2018,IEEE Division X Director (재임),학회·커뮤니티,committee,senior
fukuda,2018-10-05,2019 IEEE President-Elect 선출 발표,학회·커뮤니티,editorship,senior
fukuda,2020-01-01,IEEE 회장 취임 예정,학회·커뮤니티,editorship,senior
gini,출생,이탈리아 출생 (쌍둥이 자매 Giuseppina와 함께),개인사,birth,k12
gini,고등학교,classical studies 트랙(과학·수학·물리 + 철학),교육,k12_enroll,k12
gini,학부,"이탈리아에서 물리학 전공 (당시 컴퓨터 과학 학위 없음), 자매와 함께 수학",교육,bs_enroll,undergrad
gini,학부 시기,Maturana의 What the Eye of the Frog Tells the Brain of the Frog 논문에 영감 받아 cybernetics 관심,네트워크,influence,undergrad
gini,학부 졸업 후,"Politecnico di Milano에서 Marco Somalvico 교수 그룹 합류 (AI 연구), 자매와 공동 연구 지속",네트워크,mentor_meet,grad
gini,1976~1977,"자매와 함께 Stanford AI Lab(Arastradero Road)에서 펠로우십, Tom Binford 지도하 robotics 진입",교육,sabbatical_visit,grad
gini,Stanford 시기,블루/옐로우 Scheinman arm과 AL 언어 환경에서 인터랙티브 프로그래밍 시스템 POINTY 개발 (Russ Taylor·Raphael Finkel의 아이디어 확장),연구·프로젝트,breakthrough,grad
gini,Stanford 시기,"Shahid Mujtaba, Ron Goldman, Vic Scheinman, Bruce Shimano, Hans Moravec, Rodney Brooks, David Lowe 등과 교류",네트워크,collab_start,grad
gini,1977 후,"J1 비자 의무로 이탈리아 귀국, Politecnico di Milano에서 연구 지속",실패·전환,forced_move,grad
gini,1981,"남편이 Stanford 박사 학위 취득, Minnesota 교수직 받음",개인사,family,early_career
gini,1982,"University of Minnesota Computer Science 교수 임용 (학과 첫 여성 교수, 14명 중 유일)",직업 이력,hire,early_career
gini,1980년대 초,첫 박사생과 assembly program error detection/recovery 연구 (Max Donath의 IBM arm 사용),연구·프로젝트,proj_start,early_career
gini,1980년대 후반,"Lab Mate 모바일 로봇 도입, navigation/obstacle avoidance/door closing 연구",연구·프로젝트,proj_start,early_career
gini,sabbatical 1차,"Stanford 복귀, Jean-Claude Latombe와 motion planning 연구, 병렬 알고리즘 개발",교육,sabbatical_visit,mid_career
gini,1990년대,"Nancy 등과 병렬 motion planning, 이후 multi-agent / auction 기반 task allocation으로 전환",실패·전환,pivot,mid_career
gini,2000년대,"Trading Agent Competition 참여, Markov 기반 예측 알고리즘 (제자가 INFORMS award 수상, Rotterdam 비즈니스스쿨 교수)",네트워크,student_notable,mid_career
gini,2000년대 중반,"DARPA 펀딩으로 Scout 소형 탐사 로봇 (소다캔 크기) 설계, 상용화",창업·산업,commercialize,mid_career
gini,2006,Distributed Autonomous Robotics Systems Conference 의장,학회·커뮤니티,editorship,senior
gini,2010 무렵,"RoboCup Rescue 참여 (2회 출전), 팀 형성·시간경과 비용 task allocation 연구",연구·프로젝트,proj_start,senior
gini,인터뷰 시점,"자폐 아동 대상 humanoid robot 진단 활용 학생 지도, 다중 로봇 building 탐사 연구; 학부 AI 강의 진행",연구·프로젝트,proj_start,senior
gini,2015-01-22,College Station(TX)에서 IEEE 구술 인터뷰,개인사,personal_other,senior
goldberg,출생,"나이지리아 Ikenne(작은 마을) 출생, 부모는 교사 (부친 야금학자, 모친 심리학자)",개인사,birth,k12
goldberg,생후 6개월,"미국 Columbus, OH로 이주, 부친이 Ohio State 박사 과정",개인사,relocation,k12
goldberg,이후,"펜실베이니아 Bethlehem(철강 도시)으로 이주, 그곳에서 성장",개인사,relocation,k12
goldberg,학부,"University of Pennsylvania 입학, 처음에는 야금공학 → 전기공학 전공으로 변경",교육,bs_enroll,undergrad
goldberg,학부 3학년,"스코틀랜드에서 1년 유학, AI 강의 수강 후 로봇공학에 매료",교육,sabbatical_visit,undergrad
goldberg,학부 후반,Penn 복귀 후 Ruzena Bajcsy의 ESP(Experimental Sensory Processing) Lab에서 학부 연구,네트워크,mentor_meet,undergrad
goldberg,1984,University of Pennsylvania 전기공학 학사 학위 취득,교육,bs_graduate,undergrad
goldberg,박사 과정,"CMU 입학, Marc Raibert(tactile sensing)와 Matt Mason(manipulation 이론) 사사",교육,phd_enroll,grad
goldberg,CMU 시기,박사논문: parallel-jaw gripper의 part-orienting 알고리즘 (모든 polygonal 부품에 대한 sensorless 해법),교육,phd_thesis,grad
goldberg,CMU 시기,저마찰 gripper 메커니즘 특허 출원 (졸업 후 등록),연구·프로젝트,breakthrough,grad
goldberg,CMU 시기,"Stochastic manipulation, decision-theory 수강",교육,phd_thesis,grad
goldberg,CMU 시기,"미술 학생들과 협업, 로봇 페인팅 설치 작품, 대학원 졸업 전 학생 갤러리 개인전",연구·프로젝트,demo,grad
goldberg,1990,CMU 컴퓨터과학 박사 학위 취득,교육,phd_graduate,grad
goldberg,1990,"USC 교수 부임 (George Bekey 그룹), part feeding/fixturing 등 manipulation 연구 지속",직업 이력,hire,early_career
goldberg,1993,"USC 학생들이 World Wide Web 소개, 웹 로봇 아이디어 시작",연구·프로젝트,breakthrough,early_career
goldberg,1994-08,"Mercury Project 공개 (세계 첫 telerobot, 가상 방사능 발굴 시나리오); 1주 후 호주 Trevelyan 팀 stacking blocks 공개",연구·프로젝트,demo,early_career
goldberg,1995,"University of California, Berkeley로 이직",직업 이력,move,early_career
goldberg,1995~96 무렵,"Telegarden 공개 (9년간 24/7 운영, 컬러 카메라, 식물 키우기, 사회적 채팅)",연구·프로젝트,demo,early_career
goldberg,1995~96 무렵,"IEEE RAS Technical Committee on Networked Robots 공동 창립 (Roland Siegwart, Wolfram Burgard 등과)",학회·커뮤니티,committee,early_career
goldberg,Berkeley 초기,"철학자 Hubert Dreyfus와 만남, telepistemology 4년 프로젝트 시작",네트워크,collab_start,early_career
goldberg,1990년대 후반,Eric Paulos·John Canny와 Tele-Actor 프로젝트 (NSF 3년),연구·프로젝트,proj_start,early_career
goldberg,2000,Whitney Biennial에 Ouija board 작품 출품,연구·프로젝트,demo,mid_career
goldberg,2002,IEEE RAS 회장 Dick Volz로부터 새 자동화 저널 기획 위원장 위촉,학회·커뮤니티,editorship,mid_career
goldberg,2003~2008,"CONE(Collaborative Observatories for Natural Environments) 프로젝트 (텍사스 조류 관측), Arkansas ivory-billed woodpecker 탐색",연구·프로젝트,proj_start,mid_career
goldberg,2004,IEEE Transactions on Automation Science and Engineering 창간 (3년간 기획 결과),학회·커뮤니티,editorship,mid_career
goldberg,2005 전후,"의료 로봇으로 영역 확장, Johns Hopkins(Allison Okamura, Russ Taylor, Greg Chirikjian, Noah Cowan) 및 NIH와 협업",실패·전환,pivot,mid_career
goldberg,이후,Steerable needles 특허,연구·프로젝트,breakthrough,mid_career
goldberg,2008 무렵,Berkeley 신임 교원 Peter Abbeel과 학습 기반 surgical robotics 협업,네트워크,collab_start,mid_career
goldberg,인터뷰 시점,"Center for New Media 디렉터, Opinion Space 사회 미디어 시각화, Robotics 2.0 백서 작업, Contemporary Jewish Museum 설치 작품 진행",직업 이력,admin_role,senior
goldberg,2010-11-17,"Berkeley, CA에서 IEEE 구술 인터뷰",개인사,personal_other,senior
hagita,1954,출생,개인사,birth,k12
hagita,학부 시절,"Keio University 입학, 패턴인식 전공 (특히 손글씨 한자 인식); VAX-11/780 미니컴퓨터, Versatec 프린터 사용",교육,bs_enroll,undergrad
hagita,1976,Keio University 학사 (B.E.) 취득,교육,bs_graduate,undergrad
hagita,1978,Keio University 석사 (M.E.) 취득; NTT (Nippon Telegraph and Telephone Public Corporation) 입사,교육,ms_graduate,grad
hagita,대학 시절,1세대 신경망 연구; 호흡·통증 메커니즘 시뮬레이션 논문을 IEEE SMC에 투고,연구·프로젝트,paper,grad
hagita,1986,Keio University 박사 (Ph.D.) 취득 — 패턴인식,교육,phd_graduate,grad
hagita,박사 후,"UC Berkeley 심리학과 Steve Palmer 연구실 방문 (시각 인지, 신경망, 인지심리학); 1년 체류",교육,sabbatical_visit,early_career
hagita,NTT 복귀 후,"인사 부문 관리, 박사후 연구원 영입 프로그램 운영 (해외 20명 이상 채용)",직업 이력,admin_role,early_career
hagita,NTT 매니저 시절,인간처럼 행동하는 에이전트 통신 연구 — 음성 인식·이미지 처리·언어학 통합,연구·프로젝트,proj_start,mid_career
hagita,1996–2001,NTT Communication Science Labs Executive Manager,직업 이력,admin_role,mid_career
hagita,2001,ATR (Advanced Telecommunications Research Institute International)로 이적,직업 이력,move,mid_career
hagita,2001년 10월,ATR Media Information Science Lab 설립 및 디렉터 취임,직업 이력,admin_role,mid_career
hagita,2002년 10월,ATR Intelligent Robotics and Communication (IRC) Lab 설립; IROS (EPFL)에서 세계 주요 연구자 다수 회동,직업 이력,admin_role,mid_career
hagita,2002,우편 컴퓨팅 관련 Google Glass 유사 시스템 개발,연구·프로젝트,breakthrough,mid_career
hagita,ATR 시절,Hiroshi Ishiguro와 협업 시작; Robovie 로봇으로 초등학교 영어 학습 실험; 음성 인식 한계 → RFID 태그 도입 (2주간 영어 50단어 학습 성공),네트워크,collab_start,mid_career
hagita,2004,정부 제안 후 networked robot 신규 프로젝트 시작,연구·프로젝트,proj_start,mid_career
hagita,이후 전개,"슈퍼마켓·도심에 Robovie 도입, 사용자 활동 5cm 정밀도로 추적하는 ambient intelligence 시스템 구현; ASIMO·Paolo Dario의 Dustbot과 협업",연구·프로젝트,demo,senior
hagita,인터뷰 시점,"ATR Intelligent Robotics and Communication Lab 디렉터, ATR 이사·펠로우, ATR Creative 의장 겸임; NARA, Osaka, Kobe 대학 객원/겸임 교수",직업 이력,admin_role,senior
hagita,2013년 11월 5일,Peter Asaro 인터뷰 (도쿄),개인사,personal_other,senior
hirose,1947,도쿄 출생 (전후),개인사,birth,k12
hirose,유년기,만들기에 흥미; 가정의 일본식 욕조 가스 제어용 비전자식 알람 장치 자작,개인사,personal_other,k12
hirose,고교 시절,라디오 자작 시작; 작은 로봇 장난감 제작,개인사,personal_other,k12
hirose,학부 시절,"Yokohama National University 기계공학; Masahiro Mori의 책 ""Robot"" (NHK 출판) 읽고 로봇 연구 결심",네트워크,influence,undergrad
hirose,1971,"Yokohama National University 학사 (1등급 우등) 졸업; University of Tokyo 입시 실패, Tokyo Tech 합격 → Umetani 교수 연구실 진학",교육,bs_graduate,undergrad
hirose,석사 1년차 6월,"뱀 가게에서 실제 뱀 구입, 뱀 운동의 생체역학 실험 시작 (이후 4년간 매년 봄 뱀 구입)",연구·프로젝트,proj_start,grad
hirose,석사 2년차,"첫 snake robot 제작 — 매우 성공적, 로봇 연구 지속 결정",연구·프로젝트,breakthrough,grad
hirose,1972,첫 snake robot 완성 (본인 회고; 이후 Computer History Museum에 전시),연구·프로젝트,demo,grad
hirose,1976,Tokyo Tech 박사 학위 취득 (뱀 생체역학·snake robot 주제); Research Associate / Assistant Professor 시작,교육,phd_graduate,grad
hirose,1976,첫 quadruped (spider robot) 시도 — 실패,실패·전환,proj_fail,early_career
hirose,1978,"촉각 센서가 달린 quadruped 제작, 계단 보행 성공",연구·프로젝트,demo,early_career
hirose,1979,Tokyo Tech 부교수,직업 이력,promotion,early_career
hirose,1981 또는 1982,"Bob McGee 초청으로 Ohio State University 방문, Marc Raibert (호핑 머신) 등 만남",교육,sabbatical_visit,early_career
hirose,1980년대 중후반,ASME LA 학회에서 에너지 효율적 다리 발표; 펜타그래프 기구 → OSU의 Adaptive Suspension Vehicle에 채택,연구·프로젝트,paper,early_career
hirose,1992,Tokyo Tech 정교수,직업 이력,promotion,mid_career
hirose,1997,4족 demining 로봇 논문 발표,연구·프로젝트,paper,mid_career
hirose,1990년대 후반,"Inoue 교수 요청으로 연구용 quadruped 플랫폼 Titan VIII 설계 (150만 엔, 약 80개 판매)",창업·산업,commercialize,mid_career
hirose,2000년경,건설 회사 의뢰로 7톤 급경사용 quadruped Titan XI 개발,창업·산업,industry_collab,mid_career
hirose,2001 이후,일본 정부의 아프가니스탄 재건 지원으로 현지 방문 → walking machine 대신 buggy 차량 기반 Gryphon demining 로봇 제작,연구·프로젝트,proj_start,mid_career
hirose,2002,JCO 원전 사고 대응 로봇 — Mitsubishi Heavy Industry와 공동 제작,연구·프로젝트,proj_start,mid_career
hirose,2003,일본 정부가 원자로 로봇 지원 중단 → 로봇 학술지에 비판 논문 게재,실패·전환,funding_crisis,mid_career
hirose,2004,HiBot Corporation 공동 창립 (학생들과),창업·산업,company_found,mid_career
hirose,2002,Shengyang Institute of Technology (중국) 명예교수,수상·명예,honorary_degree,mid_career
hirose,2003,IEEE Fellow,수상·명예,fellow,mid_career
hirose,2006,일본 정부 자수포장 (Medal with Purple Ribbon),수상·명예,gov_honor,senior
hirose,2009,Joseph Engelberger Robotics Award (RIA),수상·명예,lifetime_award,senior
hirose,2011,Distinguished Professor 보직; Flagstaff에서 Selma Šabanovic 인터뷰 (2011년 8월 28일),직업 이력,admin_role,senior
hirose,2013,Tokyo Tech 명예교수; 이후 HiBot CEO & CTO,직업 이력,emeritus,senior
hirose,2014,IEEE Robotics and Automation Award,수상·명예,lifetime_award,senior
hirose,지속 활동,"Helios 시리즈 (Helios IX 운용, Helios X 설계 중) — 원전 폐로용 모바일 로봇; Kansai 전력의 고압선 점검 로봇 (5년 개발) — Robot Grand Prix 수상",연구·프로젝트,next_gen,senior
hirose,1997 이래,일본기계학회 Robot Grand Prix 창설 및 운영,학회·커뮤니티,conf_create,mid_career
hirzinger,1945,독일 Bavaria 주 Schwandorf 출생,개인사,birth,k12
hirzinger,유년·학창기,Bavaria 북부 Amberg에서 학창 생활,개인사,personal_other,k12
hirzinger,1969,Technical University of Munich 전자공학 학위 (Dipl.-Ing.) 취득; DLR 입사 — 처음에는 간섭계·고주파 기술,교육,bs_graduate,undergrad
hirzinger,DLR 초기,"6개월 후 제어 이론으로 전환; 디지털 제어 PhD 시작 (PDP-11 등 process computer); 위성 자세 제어, 공기 베어링 테이블, 불안정 항공기 (CCV) 최적 디지털 제어 연구",교육,phd_enroll,grad
hirzinger,1974,TU Munich에서 PhD 취득 — 디지털 제어,교육,phd_graduate,grad
hirzinger,1976,DLR Automation 그룹 리더 취임,직업 이력,admin_role,early_career
hirzinger,1976~1977경,디지털 제어 기계 시스템 응용 브레인스토밍 — 매니퓰레이터·수중·의수족 검토; BMW의 Wolfgang Reitzle 방문 후 ABB 로봇 1대 기증받음,연구·프로젝트,proj_start,early_career
