person,year_raw,event,type,subtype,phase
salisbury,1982,MIT AI Lab 박사후연구원으로 합류 (1년 예정이 17년 체류),교육,postdoc,early_career
salisbury,1982~1999,MIT 기계공학과 Principal Research Scientist 및 AI Lab 멤버,직업 이력,hire,early_career
salisbury,MIT 시절,Salisbury Hand 상용화 및 약 20대 판매 (소규모 회사 설립),창업·산업,commercialize,early_career
salisbury,MIT 시절,첫 박사생 Bill Townsend와 WAM(Whole Arm Manipulation) arm 개발,연구·프로젝트,proj_start,early_career
salisbury,MIT 시절,David Brock(첫 박사생)과 4-sensing finger 촉각 센서 개발,연구·프로젝트,proj_start,early_career
salisbury,MIT 시절,Brian Eberman과 force 정보 기반 재질/접촉 이벤트 추정 연구,연구·프로젝트,proj_start,early_career
salisbury,MIT 시절,Mandayam Srinivasan의 영향으로 haptics 연구로 전환,실패·전환,pivot,early_career
salisbury,MIT 시절,학부생 Thomas Massie와 PHANTOM haptic interface 개발,연구·프로젝트,breakthrough,early_career
salisbury,MIT 시절,"SensAble Technologies 공동 창업 (Massie 주도, Salisbury 지원)",창업·산업,company_found,early_career
salisbury,MIT 시절,Helen Greiner(이후 iRobot 공동창업)와 curling hand 설계,연구·프로젝트,proj_start,early_career
salisbury,MIT 시절,"Akhil Madhani와 Silver Falcon, Black Falcon 수술 로봇 시제품 개발",연구·프로젝트,proj_start,early_career
salisbury,MIT 시절,"Akhil Madhani 주도로 ball-catching arm 시스템 (Niemeyer, Hong 공저)",연구·프로젝트,demo,early_career
salisbury,1997,Intuitive Surgical에 Fellow 및 Scientific Advisor로 합류,창업·산업,industry_collab,early_career
salisbury,1999년 가을,"Stanford 복귀, Computer Science 및 Surgery 학과 Research Professor (기계공학 명예 겸직)",직업 이력,move,mid_career
salisbury,Stanford 복귀 후,"Dr. Krummel(Surgery)와 협업, NIH 지원 surgical simulation 4~5년 프로젝트",연구·프로젝트,proj_start,mid_career
salisbury,Stanford 시기,"Keenan Wyrobek, Eric Berger와 PR1(Personal Robot 1) 시제품 개발",연구·프로젝트,proj_start,mid_career
salisbury,Stanford 시기,약 40회 피칭 끝에 후원자를 찾아 Willow Garage 출범 (PR2 및 ROS 기반 마련),창업·산업,company_found,mid_career
salisbury,Stanford 시기,Dr. Nick Blevins(이비인후과)와 mastoidectomy 시뮬레이션 협업,연구·프로젝트,proj_start,mid_career
salisbury,Stanford 시기,Sonny Chan과 고해상도 CT/MRI 융합 두개골 렌더링 연구,연구·프로젝트,proj_start,mid_career
salisbury,Stanford 시기,학생 Kevin Loewke가 IVF 배아 성숙도 추적 기술로 회사 공동창업,네트워크,student_notable,mid_career
salisbury,Stanford 시기,"David Camarillo, 로봇 카테터 정확도 연구로 박사 학위",네트워크,student_notable,mid_career
salisbury,Stanford 시기,Curt Salisbury 등과 cranial-facial 6-DoF haptic interface 개발,연구·프로젝트,proj_start,mid_career
salisbury,DARPA 시기,"Sandia National Labs 통한 DARPA IED 해체용 저비용 hand 프로젝트, Curt Salisbury(PI)와 협업",연구·프로젝트,proj_start,mid_career
salisbury,2010년 11월 18일,Stanford에서 ETHW 구술 인터뷰 진행,개인사,personal_other,senior
schaal,출생,독일 출생,개인사,birth,k12
schaal,대학~박사 시절,Technical University of Munich에서 기계공학 및 AI 전공,교육,bs_enroll,undergrad
schaal,박사 시기,"Klaus Ehrlenspiel (Department for Engineering Design) 지도, CAD/AI 기반 설계 연구",교육,phd_thesis,grad
schaal,1980년대 후반,MIT의 신경망/계산 모터 컨트롤 신조류 흐름 속 박사후 연구 시작,네트워크,influence,grad
schaal,1988,"Munich 공대 석사(Diploma, 기계공학) 취득",교육,ms_graduate,grad
schaal,1991,"Munich 공대 박사(Ph.D., 기계공학+AI) 취득",교육,phd_graduate,grad
schaal,1991~1994,MIT Brain & Cognitive Sciences 학과 및 AI Lab 박사후 연구원,교육,postdoc,early_career
schaal,MIT 시절,Chris Atkeson 지도하에 5-ball bounce juggler 등 저글링 머신 개발,연구·프로젝트,demo,early_career
schaal,MIT 시절,"Marc Raibert, Emilio Bizzi 등과 같은 환경에서 연구",네트워크,collab_start,early_career
schaal,1992,ATR 일본 연구소(Mitsuo Kawato 그룹)와 협업 시작,네트워크,collab_start,early_career
schaal,1992,Santa Fe Complex Systems Summer School 참가,학회·커뮤니티,conf_attend,early_career
schaal,1994~2002,매년 약 4개월 이상 일본 ATR에서 연구,교육,sabbatical_visit,early_career
schaal,1996,"Kawato 그룹 ERATO 5년 연구비 확보, 휴머노이드 로봇 연구 본격화",연구·프로젝트,proj_start,early_career
schaal,1997,University of Southern California(USC) 교수로 부임 (Maja Mataric와 동시 임용),직업 이력,hire,early_career
schaal,포스닥/USC 초기,Georgia Tech Adjunct Assistant Professor,직업 이력,hire,early_career
schaal,포스닥/USC 초기,Penn State University Kinesiology 학과 Adjunct Assistant Professor (행동 실험 협업),직업 이력,hire,early_career
schaal,1998,ATR ERATO 프로젝트로 세계 최초기 휴머노이드 중 하나 개발,연구·프로젝트,breakthrough,early_career
schaal,2000년대 중반,EPFL의 Auke Eisberg(원문 표기)와 motor primitives 기반 imitation learning 접근법 개발,연구·프로젝트,breakthrough,mid_career
schaal,2005년경,Robotics: Science and Systems(RSS) 컨퍼런스 공동 창립 참여,학회·커뮤니티,conf_create,mid_career
schaal,2009년경,DARPA Little Dog 프로젝트로 거친 지형 사족 보행 머신러닝 연구 종료,연구·프로젝트,proj_complete,mid_career
schaal,인터뷰 시점,"Sarcos hydraulic humanoid, PR2(Willow Garage), NAO, Barrett arm, HUBO 등 다수 플랫폼 보유",연구·프로젝트,proj_start,senior
schaal,인터뷰 시점,Gerald Loeb (USC BME)와 인간 피부 유사 촉각 센서 협업,네트워크,collab_start,senior
schaal,인터뷰 시점,Gaurav Sukhatme와 grasping/manipulation 공동 프로젝트 진행,네트워크,collab_start,senior
schaal,인터뷰 시점,"Max-Planck Institute for Intelligent Systems (Tuebingen) 창립 디렉터, ATR Computational Neuroscience Lab Invited Researcher",직업 이력,admin_role,senior
schaal,2010년 11월 12일,Los Angeles에서 Peter Asaro와 ETHW 구술 인터뷰,개인사,personal_other,senior
scheinman,1942년 12월 28일,미국 Georgia 주 Augusta에서 출생 (부친은 미 육군 군의관),개인사,birth,k12
scheinman,2차대전 후,가족과 함께 New York Brooklyn으로 이주,개인사,relocation,k12
scheinman,8~9세경,"영화 ""The Day the Earth Stood Still""에서 로봇 처음 접함; 부친 권유로 나무 로봇 모형 제작",네트워크,influence,k12
scheinman,초등 5학년,친구의 영향으로 MIT 진학을 꿈꾸기 시작,네트워크,influence,k12
scheinman,중학생 시절,"Bronx로 이주, 사립 고등학교 진학",개인사,relocation,k12
scheinman,13세경,Ham radio 자격 취득,개인사,personal_other,k12
scheinman,1959,"16세에 MIT 입학, Aero/Astro 전공",교육,bs_enroll,undergrad
scheinman,학부 시절,Sikorsky Aircraft 인턴 (헬리콥터 부서),개인사,personal_other,undergrad
scheinman,1963,"MIT 학사(B.S., Aeronautics & Astronautics) 취득; Louie de Flores 상 수상",교육,bs_graduate,undergrad
scheinman,1963,"Boeing(Mahogany Row) 단기 근무 후 세계여행 (Tahiti, NZ, Australia, Philippines, Thailand 등)",직업 이력,hire,early_career
scheinman,1964년경,"인도에서 징집 통지 받고 미국 귀국, Stanford 대학원 진학 (Aero/Astro → ME로 전과)",교육,ms_enroll,grad
scheinman,대학원 여름,"Apollo 프로그램 두 차례 참여 (열차폐, Saturn 터보펌프)",개인사,personal_other,grad
scheinman,Stanford 석사,기계공학 석사 1년 만에 취득,교육,ms_graduate,grad
scheinman,박사후 과정,"Engineer's degree 시작, AI Lab 합류, Bernie Roth와 협업",교육,phd_enroll,grad
scheinman,AI Lab 시기,Rancho Arm 보수 및 컴퓨터 인터페이스 작업,연구·프로젝트,proj_start,grad
scheinman,AI Lab 시기,Larry Leifer와 ORM(snake-like pneumatic arm) 프로젝트 (Don Pieper 박사논문),연구·프로젝트,proj_start,grad
scheinman,AI Lab 시기,"Hydraulic arm 개발 (PDP-6/PDP-10, space-war 모드)",연구·프로젝트,proj_start,grad
scheinman,1966~1968경,"George Devol/Joe Engelberger 후원 fellowship으로 Unimation, GM 등 산업현장 투어",창업·산업,industry_collab,grad
scheinman,1969경,Engineer's degree 학위 (Stanford Arm 설계가 논문 주제),교육,phd_graduate,grad
scheinman,1969~1970,Raychem(Menlo Park) 자동화 엔지니어링 근무,직업 이력,hire,early_career
scheinman,1970년경,"Stanford 복귀, Stanford Arm(gold/blue) 제작, John McCarthy/Les Earnest와 협력",연구·프로젝트,breakthrough,early_career
scheinman,초기 1970년대,"SRI(Charlie Rosen, David Nitzen)와 JPL용 Stanford Arm 제작 협력",연구·프로젝트,proj_start,early_career
scheinman,1972,"Marvin Minsky 초청으로 MIT에서 여름 체류, 소형 MIT Arm(이후 PUMA 260) 설계",연구·프로젝트,breakthrough,early_career
scheinman,1973,Vicarm Inc. 설립 (Mountain View),창업·산업,company_found,early_career
scheinman,Vicarm 시기,"Bruce Shimano (소프트웨어, VAL), Brian Carlisle (제작) 채용",창업·산업,industry_collab,early_career
scheinman,Vicarm 시기,"GM, NBS, AT&T, Naval Research Lab, Boston Univ. 등에 arm 납품",창업·산업,commercialize,early_career
scheinman,1970년대 초~중,Robots-1(시카고)에서 Engelberger 부스 통해 Vicarm 첫 공개,학회·커뮤니티,conf_attend,early_career
scheinman,1977,"Vicarm을 Unimation에 매각, Unimation 서부지부장으로 합류",창업·산업,exit,early_career
scheinman,1977~1979경,GM과 협력해 PUMA(Programmable Universal Machine for Assembly) 개발,연구·프로젝트,breakthrough,mid_career
scheinman,Unimation 시기,"PUMA 양산 영국, 미국, Kawasaki(라이선스) 3곳에서 진행",창업·산업,commercialize,mid_career
scheinman,1980년경,"Phil Villers와 Automatix 공동 창업 (벤처 자금, Massachusetts 본사)",창업·산업,company_found,mid_career
scheinman,Automatix 시기,용접/조립/비전 3개 제품군; SRI 비전 알고리즘 라이선싱,창업·산업,commercialize,mid_career
scheinman,Automatix 시기,"Don Pieper(VP Engineering), Gordon VanderBrug 등 영입",창업·산업,industry_collab,mid_career
scheinman,Automatix 시기,"Robot World 시스템 개발, GM과 HP(잉크젯 카트리지) 등에 납품",창업·산업,commercialize,mid_career
scheinman,Automatix 시기,"Yaskawa에 Robot World, 조립/용접 라인 매각",창업·산업,exit,mid_career
scheinman,Yaskawa 시기,컨설턴트로 Robot World 추가 개발 (약 700~800대 판매),창업·산업,industry_collab,mid_career
scheinman,1990년대 후반,"Stanford에 Consulting Professor로 합류, 약 10~15년 활동",직업 이력,hire,senior
scheinman,Brian/Bruce 후일,"Brian Carlisle, Bruce Shimano가 Adept Technology 분사 창업",네트워크,student_notable,senior
scheinman,인터뷰 직전,"은퇴, 고교 로보틱스 그룹 멘토링, UC-Davis 학생 프로젝트 후원, Precise Automation 투자",직업 이력,retire,senior
scheinman,2010년 11월 19일,"Woodside, CA에서 Peter Asaro & Selma Šabanović와 ETHW 구술 인터뷰",개인사,personal_other,senior
sharkey,1948,북아일랜드 Belfast Royal Victoria Hospital에서 출생,개인사,birth,k12
sharkey,4세경,"부친 발병, 가족이 어머니의 고향 Coleraine으로 이주",개인사,relocation,k12
sharkey,유년기,Coleraine에서 유년·청소년기 교육,교육,k12_enroll,k12
sharkey,대학 직전,University of Coleraine에서 견습 전기공으로 일하며 University of Ulster 건설 참여,개인사,personal_other,k12
sharkey,1970,21세에 영국으로 건너가 정신과 간호사로 근무 시작 (1000-bed 병원),직업 이력,hire,k12
sharkey,1970년대 초반,"간호사 중도 포기 후 2년간 휴식, 이후 고등학교 다시 다님",교육,k12_enroll,k12
sharkey,대학 진학,"영국 대학에서 영어, 수학, 음악, 심리학, 영문학 수강",교육,bs_enroll,undergrad
sharkey,박사 시기,Exeter University에서 Don Mitchell 지도하에 실험심리학 박사,교육,phd_thesis,grad
sharkey,박사 시기,단어 인식(top-down 모델) 연구; Schank/Abelson scripts에 영향,교육,phd_thesis,grad
sharkey,1981년경,"Yale University 박사후 연구원, Roger Schank의 AI Lab에서 자연어 이해 연구",교육,postdoc,early_career
sharkey,1981년 이후,"머신러닝 연구로 전환, 미적분/선형대수 학습 시작",실패·전환,pivot,early_career
sharkey,Stanford 시절,"Gordon Bower 연구실 합류 (35세 전), 인지심리/메모리 연구",교육,sabbatical_visit,early_career
sharkey,35세경,New Blood Lectureship으로 영국 Essex University 언어학과 복귀,직업 이력,hire,early_career
sharkey,Essex 시기,"2년 만에 tenure, 이후 Reader 및 Centre for Cognitive Science 디렉터로 승진",직업 이력,promotion,mid_career
sharkey,Essex 후반,"컴퓨터과학과로 이동, 로봇 도입",실패·전환,pivot,mid_career
sharkey,1988년경,Lakoff 그룹(Berkeley) 단기 방문 후 grounded language 관심,교육,sabbatical_visit,mid_career
sharkey,1988년 이후,"첫 로봇 ""Frank"" (biscuit tin 형태) 신경망 학습 실험 — 복도 자율주행 성공",연구·프로젝트,breakthrough,mid_career
sharkey,초기 1990년대,"Nomad 로봇 (25k$) 도입, Khepera 로봇 등 다수 운용; 약 12명 박사생 규모 랩 구축",연구·프로젝트,proj_start,mid_career
sharkey,1990년대 초반,"London에서 bio-inspired robotics 컨퍼런스 운영, BBC 첫 TV 출연 (의도치 않게 뉴스 생방송에 등장)",학회·커뮤니티,conf_create,mid_career
sharkey,1990년대 초반,"BBC2 ""Tomorrow's World""에서 카메라 GA back-prop 실험 시연",연구·프로젝트,demo,mid_career
sharkey,1990년대 중반,Sheffield 대학교 컴퓨터과학과 정교수로 부임 (with safety-critical systems 그랜트),직업 이력,promotion,mid_career
sharkey,1990년대 후반,"BBC ""Robot Wars"" 심사위원으로 합류, 7시리즈 + 국제판 등 16시리즈 진행",개인사,personal_other,mid_career
sharkey,같은 시기,"BBC ""Techno Games"" 해설자, ""Bright Sparks"" 공동진행",개인사,personal_other,mid_career
sharkey,2000년경,Rotherham(영국) Magna Science Adventure Centre에 5명 포닥 팀과 predator-prey GA 로봇 전시 개발 (18개월),연구·프로젝트,proj_start,mid_career
sharkey,2000년대 초반,"14ft 자율 비행선(blimp) 프로젝트, Per Lindstrand 제작, Magna에서 운용",연구·프로젝트,proj_start,mid_career
sharkey,2000년대 중반,EPSRC Senior Media Fellowship 수여 (3년 + 2년 연장),수상·명예,fellow,senior
sharkey,2005~2006경,군용 무인기/자율무기에 대한 본격적 조사 및 인도주의법 학습,실패·전환,pivot,senior
sharkey,2007,"The Guardian 기고 ""Robot Wars are a Reality"" — 로봇이 전투원/비전투원 식별 불가 주장",개인사,personal_other,senior
sharkey,2008년경,"Jurgen Altmann, Rob Sparrow, Peter Asaro 등과 Sheffield에서 회동",네트워크,collab_start,senior
sharkey,2009년경,International Committee for Robot Arms Control(ICRAC) 공동 창립,학회·커뮤니티,conf_create,senior
sharkey,교수 후반,Connection Science 저널 편집장 (22년 재임),학회·커뮤니티,editorship,senior
sharkey,교수 후반,"Centre for the Policy of Emerging Technologies(유럽지부) 디렉터, NHS Health 2020 자문, Nuffield Foundation 위원",학회·커뮤니티,committee,senior
sharkey,인터뷰 시점,"64세, Sheffield 대학교 로보틱스/AI 정교수",직업 이력,hire,senior
sharkey,2013년 3월 24일,Sheffield에서 Peter Asaro와 ETHW 구술 인터뷰,개인사,personal_other,senior
shimano,출생,"캘리포니아 Los Angeles 출생, 그 곳에서 성장",개인사,birth,k12
shimano,1967,"Stanford 대학교 입학 (학부, 기계공학)",교육,bs_enroll,undergrad
shimano,2학년 시,Bernard Roth 지도 학생으로 배정 (이후 학부~박사 내내 지도),네트워크,mentor_meet,undergrad
shimano,1972,Stanford에서 5년 만에 학사+석사(컴퓨터 그래픽스) 동시 취득,교육,ms_graduate,grad
shimano,1972~1974,Stanford 떠나 2년간 외부 활동,개인사,personal_other,grad
shimano,1974,"Stanford 박사과정으로 복귀, SAIL(Stanford AI Lab) Hand-Eye Group 합류, Lou Paul 사사",교육,phd_enroll,grad
shimano,SAIL 시기,"AL(원래 HAL) 언어 개발에 합류, Victor Scheinman과 같은 사무실 사용",연구·프로젝트,proj_start,grad
shimano,SAIL 시기,"Tom Binford(비전), Bob Bolles, Ray Finkel 등과 함께 연구",네트워크,collab_start,grad
shimano,1976~1977경,Victor Scheinman의 Vicarm에서 GM용 VAL 테스트 소프트웨어 파트타임 개발,창업·산업,industry_collab,grad
shimano,1978~1979경,"SAIL 박사과정 종료, Vicarm/Unimation 정규 합류 (LA 거주)",직업 이력,hire,early_career
shimano,1978~1979경,Robots 9 컨퍼런스에서 SRI/Machine Intelligence 비전 시스템과 첫 통합 데모,연구·프로젝트,demo,early_career
shimano,1979년경,"Vicarm이 Unimation에 매각, 회사는 Unimation 서부지부가 됨",창업·산업,exit,early_career
shimano,1979~1980경,"GM RFQ 수주, PUMA(Programmable Universal Machine for Assembly) 개발 시작",연구·프로젝트,proj_start,early_career
shimano,1979~1980경,약 18개월 만에 첫 PUMA 프로토타입 납품; Brian Carlisle이 Danbury로 기술이전 담당,연구·프로젝트,proj_complete,early_career
shimano,1980년경,"박사학위(Ph.D., Mechanical Engineering, Stanford) 취득",교육,phd_graduate,early_career
shimano,1980~1981경,GM 공장에 PUMA 첫 도입,창업·산업,commercialize,early_career
shimano,1982년 12월,Unimation이 Westinghouse에 매각 완료,창업·산업,exit,early_career
shimano,1983년 6월,Brian Carlisle와 Adept Technology 공동 창업 (Westinghouse 소수지분 + 벤처투자); R&D 부사장,창업·산업,company_found,early_career
shimano,1985년 6월,Adept 1 (direct-drive SCARA) 시연,연구·프로젝트,demo,mid_career
shimano,1986~1987경,Elaine Wood 주도로 PCB 이상(odd) 부품 fiducial 비전 응용 개발,연구·프로젝트,proj_start,mid_career
shimano,1980년대 말,"Adept 1 양산, U.S. 어셈블리 로봇 시장 확립",창업·산업,commercialize,mid_career
shimano,1990년대 초,"미국 산업용 로봇 회사 다수 도태, Adept이 사실상 유일한 미국 로봇 회사로 남음",외부 영향,field_crisis,mid_career
shimano,1996,Adept Technology 상장(IPO),창업·산업,exit,mid_career
shimano,2000년대 초,광통신(photonics) 시장에 큰 베팅,창업·산업,commercialize,mid_career
shimano,2001년 9·11,"Photonics 붕괴 + 9/11으로 매출 100M$ → 30~40M$로 축소, 인원 2/3 감원",실패·전환,funding_crisis,mid_career
shimano,2003년 12월,Adept 경영진 교체로 Brian Carlisle와 동반 사임 (R&D 부사장 및 비서직),직업 이력,move,mid_career
shimano,2004,"Brian Carlisle와 Precise Automation LLC 공동 창업, COO 및 R&D 부사장",창업·산업,company_found,senior
shimano,Precise 시기,"소형 조직 + 외부 제조 파트너 모델, Lab automation/제약/반도체/패키징 집중",창업·산업,commercialize,senior
shimano,인터뷰 시점,Precise Automation 운영 중,직업 이력,admin_role,senior
shimano,2010년 11월 12일,Los Angeles에서 Peter Asaro와 ETHW 구술 인터뷰,개인사,personal_other,senior
shirai,1941년 8월 3일,일본 Toyota 시 출생 (부친 Takeaki Shirai는 Toyota → Denso 근무),개인사,birth,k12
shirai,유년기,Nagoya 인근에서 성장,개인사,personal_other,k12
shirai,고등학교,Nagoya의 Tokai High School 졸업,교육,k12_graduate,k12
shirai,1960년경,Nagoya University 기계공학과 입학,교육,bs_enroll,undergrad
shirai,1964,"Nagoya University 학사(B.Eng., 기계공학) 취득",교육,bs_graduate,undergrad
shirai,1964,"Tokyo University 대학원 진학, Masahiro Mori 연구실 합류 (3-finger pneumatic robot 첫 시연 목격)",교육,ms_enroll,grad
shirai,석사 시기,"Ichiro Kato(Waseda) 방문, tactile 센서 보고 자체 개량 시도 (rubber/carbon powder)",연구·프로젝트,proj_start,grad
shirai,석사 시기,손가락 센서 한계 인식 후 vision으로 연구 방향 전환,실패·전환,pivot,grad
shirai,1964년경,"Perceptron 책 발견, 약 1년간 응용 시도 후 한계 인식",네트워크,influence,grad
shirai,1966,Tokyo University 석사(M.Eng.) 취득,교육,ms_graduate,grad
shirai,박사 시기,"Operations Research(임업), 그리고 X-ray 용접 결함 분석 연구",교육,phd_thesis,grad
shirai,1969,Tokyo University 박사(Dr.Eng.) 취득; Pattern Recognition Vol.1에 기고,교육,phd_graduate,grad
shirai,1969,"박사 직후 통상산업성 산하 Electrotechnical Laboratory(ETL) 입사, robot vision group",직업 이력,hire,early_career
shirai,ETL 초기,"Saburo Tsuji 사사, blocks-world 라인 드로잉/4-방향 조명 기법 개발",연구·프로젝트,breakthrough,early_career
shirai,ETL 초기,Rangefinder 개발 (광선 투사 + 스캔 방식),연구·프로젝트,breakthrough,early_career
shirai,1971,Marvin Minsky에게 두 편의 논문(조명/range finder) 보내며 MIT 방문 신청,네트워크,collab_start,early_career
shirai,1971~1972,"MIT AI Lab 1년 체류, image dissector camera로 line-finder 개선; Minsky/Winston과 친분",교육,sabbatical_visit,early_career
shirai,1972,"일본 Pattern Information Processing Project 시작에 따라 ETL로 귀국, 3D 부분 책임자",연구·프로젝트,proj_start,early_career
shirai,1970년대,"Tsukuba 이전 직전, 책상 위 일반 물체(컵, 전화기 등) 인식 장기 연구 (약 5년)",연구·프로젝트,proj_start,early_career
shirai,1970년대 후반,Oshima와 자동차 부품 인식 연구 (Takayanagi 상 수상),수상·명예,paper_award,early_career
shirai,1970년대,위 X-ray 자동 스크리닝 연구 (Tokyo Univ. 의사 협력); CT 뇌영상 협업,연구·프로젝트,proj_start,early_career
shirai,1979,"ETL이 Tokyo에서 Tsukuba로 이전, Shirai는 Computer Vision 섹션장으로 승진",직업 이력,promotion,early_career
shirai,1979 이후,"Katsushi Ikeuchi(이후 MIT/CMU) 지도, photometric stereo 연구 지원",네트워크,student_notable,mid_career
shirai,1979 이후,Sugihara(line drawing from rangefinder) 등 후학 지도,네트워크,student_notable,mid_career
shirai,1980년대 초,"위험환경 첨단 로봇 프로젝트 참여 (Hitachi 보행, Mitsubishi 원격조작, Toshiba 비전)",연구·프로젝트,proj_start,mid_career
shirai,1985,"ETL 제어부 Director로 승진 (manipulator section 포함, 약 40명 + 외부 연구자)",직업 이력,promotion,mid_career
shirai,1985,"Tsukuba Expo, Mitterrand/Thatcher 방문 시 direct-drive manipulator 시연 사고",연구·프로젝트,demo,mid_career
shirai,1985~1989경,Japan Society for AI 이사,학회·커뮤니티,committee,mid_career
shirai,1987~1989,Information Processing Society of Japan 이사,학회·커뮤니티,committee,mid_career
shirai,1988,Osaka University 기계공학(전기제어) 정교수로 부임,직업 이력,move,mid_career
shirai,Osaka 시기,"Minoru Asada, Yoshinori Kuno 등과 협업",네트워크,collab_start,mid_career
shirai,Osaka 시기,"Outdoor scene 이해, stereo vision, 사람 추적 연구 시작",연구·프로젝트,proj_start,mid_career
shirai,Osaka 시기,이동 매니퓰레이터 로봇 (장애인/노인 보조용 — 냉장고에서 음료 가져오기) 개발,연구·프로젝트,proj_start,mid_career
shirai,Osaka 시기,"축구 경기 영상 분석, 손짓/제스처 인식 연구 진행",연구·프로젝트,proj_start,mid_career
shirai,2005년경,Ritsumeikan University로 이동 (인터뷰 당시 6년차),직업 이력,move,senior
shirai,Ritsumeikan 시기,"골프 스윙 분석 (실내 2 카메라 → 실외 1 카메라), 핸드 포스처 3D 인식 연구",연구·프로젝트,proj_start,senior
shirai,2011년 8월 30일,"Flagstaff, AZ에서 Selma Šabanović와 Matthew Francisco가 ETHW 구술 인터뷰 진행",개인사,personal_other,senior
siciliano,1959년 10월 27일,이탈리아 Naples 출생,개인사,birth,k12
siciliano,유년기 ~ 학부,"Naples에서 과학계열 고등학교(Lyceum) 졸업, University of Naples Federico II 전자공학 입학",교육,bs_enroll,undergrad
siciliano,1982,"4년 반 만에 Laurea(석사 상당) 취득, 전자공학",교육,ms_graduate,undergrad
siciliano,1982 직후,"새로 도입된 Research Doctorate(Ph.D.) 첫 기수로 진학, Lorenzo Sciavicco의 권유로 로보틱스 연구",교육,phd_enroll,grad
siciliano,박사 초기,"RoManSy 컨퍼런스에서 Bernie Roth, Oussama Khatib 만남 (Khatib와 평생 친구)",네트워크,mentor_meet,grad
siciliano,1983,Chicago에서 ISIR(첫 산업로봇 국제 학회) 참가,학회·커뮤니티,conf_attend,grad
siciliano,1985년 9월~1986년 6월,"Georgia Tech 기계공학과 Wayne Book 그룹 방문 학자, RALF(flexible arm) 프로젝트",교육,sabbatical_visit,grad
siciliano,1986,"미국 여행 후 Naples 복귀, 박사 논문 마무리 대기",개인사,personal_other,grad
siciliano,1986,첫 ICRA 참석 (San Francisco),학회·커뮤니티,conf_attend,grad
siciliano,1987,"Naples에서 박사학위(Dr.Eng., 전자공학) 취득",교육,phd_graduate,grad
